Event_Title;Event_Description;Relevant_Quality;Event_Duration;Cost_Per_Day
Goofy Impersonation Contest;Compete in the Goofy Impersonation Contest, using your charisma and mimicry skills to impersonate famous personalities in a humorous showdown.;Charisma;3;19
Slapstick Comedy Workshop;Attend the Slapstick Comedy Workshop, where your improvisation will be refined as you learn the art of slapstick humor and physical comedy.;Improvisation;4;21
Silly Hat Dance Party;Join the Silly Hat Dance Party, showcasing your charisma as you boogie and groove wearing the wackiest and most eccentric hats.;Charisma;2;17
Comical Animal Olympics;Participate in the Comical Animal Olympics, where your reliability and precision will be tested in hilarious events mimicking animal movements.;Reliability;3;18
Whimsical Puppeteer Extravaganza;Showcase your creativity and charisma in the Whimsical Puppeteer Extravaganza, putting on a whimsical and humorous puppet show.;Charisma;4;20
Crazy Frog Jumping Competition;Compete in the Crazy Frog Jumping Competition, showcasing your improvisation and leaping skills in a fun and quirky frog jumping contest.;Improvisation;5;22
Silly Clown Pie Toss;Take part in the Silly Clown Pie Toss, using your charisma to entertain the crowd with pie-throwing antics and funny reactions.;Charisma;3;19
Laughter Yoga Marathon;Join the Laughter Yoga Marathon, where your charisma will lead a non-stop session of laughter yoga to spread joy and positive energy.;Charisma;4;21
Wacky Egg and Spoon Race;Race in the Wacky Egg and Spoon Race, where your reliability will be tested as you balance and carry an egg on a spoon.;Reliability;2;16
Comedic Improv Battle;Engage in the Comedic Improv Battle, showcasing your improvisation and quick wit as you face off in a hilarious improvisation competition.;Improvisation;3;18
Funny Clown Car Chaos;Join the Funny Clown Car Chaos, where your charisma will entertain the audience as you and fellow clowns pile out of a tiny clown car.;Charisma;4;21
Silly Dancing Flash Mob;Participate in the Silly Dancing Flash Mob, using your improvisation and dance moves to surprise and entertain passersby.;Improvisation;5;23
Whacky Waiter's Restaurant;Work as a waiter at the Whacky Waiter's Restaurant, where your charisma and comedic flair will amuse and delight diners.;Charisma;3;19
Crazy Hair Styling Salon;Work at the Crazy Hair Styling Salon, using your creativity to give clients the wackiest and most humorous hairstyles.;Improvisation;4;22
Silly Animal Impersonations;Show off your charisma by performing Silly Animal Impersonations, imitating various animals in the most humorous and entertaining way.;Charisma;2;17
Laughing Mirror Maze;Navigate through the Laughing Mirror Maze, where your improvisation and humor will entertain visitors as they find their way through the mirrors.;Improvisation;3;19
Funny Face Painting Booth;Run a Funny Face Painting Booth, showcasing your creativity and charisma as you paint comical and whimsical designs on delighted faces.;Charisma;4;21
Wacky Trampoline Bouncing;Bounce on the Wacky Trampoline, showcasing your reliability and comedic movements in a hilarious and entertaining trampoline show.;Reliability;3;18
Silly Dance Off Party;Host a Silly Dance Off Party, using your charisma to encourage guests to show off their silliest dance moves and have a blast.;Charisma;4;20
Jokester's Stand-Up Open Mic;Take the mic at the Jokester's Stand-Up Open Mic, showcasing your charisma with a set of side-splitting jokes and funny anecdotes.;Charisma;5;22
Wacky Chair Racing Derby;Race in the Wacky Chair Racing Derby, using your improvisation and creativity to transform ordinary chairs into amusing racing vehicles.;Improvisation;3;18
Circus Clown Balloon Animal Show;Perform in the Circus Clown Balloon Animal Show, using your charisma to create and give away funny and whimsical balloon animals.;Charisma;4;21
Comedic Magic Show Spectacle;Host a Comedic Magic Show Spectacle, where your charisma and humor will make the audience laugh and marvel at your hilarious magic tricks.;Charisma;2;17
Whimsical Talent Show Extravaganza;Participate in the Whimsical Talent Show Extravaganza, showcasing your charisma and unique talents in a showcase of laughter and fun.;Charisma;3;19
Prankster's Prank War;Engage in the Prankster's Prank War, using your improvisation and wit to outsmart and pull funny pranks on fellow participants.;Improvisation;4;21
Silly Obstacle Course Challenge;Conquer the Silly Obstacle Course Challenge, showcasing your reliability and humor in navigating quirky and amusing obstacles.;Reliability;3;18
Crazy Comedian Roast Night;Take the stage at the Crazy Comedian Roast Night, using your charisma and sharp humor to roast fellow comedians in a good-natured manner.;Charisma;4;20
Whacky Pie Eating Contest;Compete in the Whacky Pie Eating Contest, using your improvisation and hearty appetite to devour pies in the silliest manner possible.;Improvisation;5;23
Amusing Clown Bowling Tournament;Join the Amusing Clown Bowling Tournament, where your charisma will entertain the crowd with funny and unusual bowling techniques.;Charisma;3;19
Funny Face Swap Booth;Run a Funny Face Swap Booth, using your creativity and charisma to create hilarious face swaps for visitors using special effects.;Charisma;4;22
Silly Rubber Chicken Olympics;Participate in the Silly Rubber Chicken Olympics, where your reliability will be tested in a series of wacky and entertaining challenges.;Reliability;2;16
Comical Improv Theatre Workshop;Attend the Comical Improv Theatre Workshop, where your improvisation and comedic timing will be honed through humorous theater exercises.;Improvisation;3;18
Silly Banana Peel Slippery Slope;Slide down the Silly Banana Peel Slippery Slope, where your improvisation will come in handy to navigate the hilariously slippery slope.;Improvisation;4;20
Crazy Karaoke Lip Sync Battle;Compete in the Crazy Karaoke Lip Sync Battle, using your charisma and hilarious lip-syncing skills to entertain the audience.;Charisma;5;23
Goofy Grandma Grand Prix;Participate in the Goofy Grandma Grand Prix, where your reliability will be tested in funny and zany challenges for spirited grandmas.;Reliability;3;18
Hysterical Laughter Club;Join the Hysterical Laughter Club, using your charisma to lead a session of infectious laughter to uplift spirits and spread joy.;Charisma;4;21
Silly Puppet Improv Showdown;Showcase your creativity and improvisation in the Silly Puppet Improv Showdown, putting on a sidesplitting and unpredictable puppet improv show.;Improvisation;5;23
Jolly Jester's Stand-Up Gig;Take the stage at the Jolly Jester's Stand-Up Gig, where your charisma will entertain the audience with a barrage of witty jokes and humor.;Charisma;6;25
Crazy Barrel Roll Race;Race in the Crazy Barrel Roll Race, showcasing your reliability and humorous movements as you roll hilariously inside giant barrels.;Reliability;4;22
Laughing Baby Animal Encounter;Experience the Laughing Baby Animal Encounter, where your charisma will bring joy and laughter as you interact with adorable and playful baby animals.;Charisma;3;19
Colorful Clown Parade;Join the Colorful Clown Parade, showcasing your charisma as you march and spread laughter with fellow clowns in a delightful parade.;Charisma;4;21
Silly Slapstick Talent Show;Participate in the Silly Slapstick Talent Show, using your improvisation and comedic skills to perform uproarious slapstick routines.;Improvisation;5;23
Goofy Alien Impersonation Contest;Compete in the Goofy Alien Impersonation Contest, using your charisma and creativity to portray hilariously quirky extraterrestrial characters.;Charisma;3;18
Whimsical Rubber Duck Race;Race in the Whimsical Rubber Duck Race, showcasing your reliability and comedic flair as you navigate a river of floating rubber ducks.;Reliability;4;20
Laughing Clown Flash Mob;Join the Laughing Clown Flash Mob, using your charisma and clown antics to surprise and brighten the day for passersby.;Charisma;5;24
Silly T-Rex Dance Party;Dance at the Silly T-Rex Dance Party, showcasing your improvisation and charisma as you groove like a T-Rex to hilarious beats.;Improvisation;4;22
Comedic Magic Trick Fails;Perform in the Comedic Magic Trick Fails show, using your charisma to entertain the audience with amusing and humorous magic trick mishaps.;Charisma;3;18
Crazy Coconut Bowling Bonanza;Compete in the Crazy Coconut Bowling Bonanza, where your improvisation and aim will be tested in bowling with coconuts.;Improvisation;4;21
Silly Clown Caravan Adventure;Embark on a Silly Clown Caravan Adventure, using your charisma to entertain and amuse townsfolk as you journey with a merry caravan of clowns.;Charisma;5;22
Goofy Face Swap Frenzy;Participate in the Goofy Face Swap Frenzy, using your creativity and charisma to create hilarious face swaps with friends and family.;Charisma;3;20
Silly Balloon Olympics;Join the Silly Balloon Olympics, showcasing your reliability and humor as you participate in quirky and amusing events with balloons.;Reliability;4;22
Laughing Yoga Dance Party;Attend the Laughing Yoga Dance Party, where your charisma will lead a session of laughter-filled yoga and dance to uplift spirits.;Charisma;5;23
Whacky Potato Cannon Challenge;Compete in the Whacky Potato Cannon Challenge, showcasing your improvisation and accuracy in launching potatoes with comically oversized cannons.;Improvisation;4;20
Circus Clown Pie Fight;Take part in the Circus Clown Pie Fight, using your charisma and comedic timing to engage in a hilarious and messy pie-throwing extravaganza.;Charisma;3;19
Hilarious Mirror Funhouse;Navigate through the Hilarious Mirror Funhouse, where your improvisation and humor will entertain visitors as they encounter amusing reflections.;Improvisation;4;21
Silly Face Paint Freeze Tag;Play Silly Face Paint Freeze Tag, showcasing your charisma and creativity in a game of tag where players are painted with funny faces.;Charisma;5;22
Laughing Rubber Chicken Duel;Engage in the Laughing Rubber Chicken Duel, using your improvisation and humor in a hilarious duel using rubber chickens.;Improvisation;3;19
Goofy Pet Beauty Pageant;Participate in the Goofy Pet Beauty Pageant, showcasing your reliability and charisma as you present your pets in hilarious and quirky categories.;Reliability;4;21
Crazy Pancake Flip Challenge;Compete in the Crazy Pancake Flip Challenge, using your improvisation and pancake flipping skills to create funny and entertaining pancake art.;Improvisation;5;24
Silly Clown Musical Parade;Join the Silly Clown Musical Parade, showcasing your charisma as you march and play lively tunes with fellow clowns in a comical parade.;Charisma;4;20
Hilarious Duckling Racing Derby;Race in the Hilarious Duckling Racing Derby, showcasing your reliability as you cheer on and guide adorable ducklings in a funny and charming race.;Reliability;3;18
Whimsical Face Mask Fashion Show;Participate in the Whimsical Face Mask Fashion Show, showcasing your charisma and creativity in a hilarious runway show of funny face masks.;Charisma;4;21
Silly Mirror Lip Sync Battle;Engage in the Silly Mirror Lip Sync Battle, where your improvisation and comedic flair will be on display as you lip-sync in front of funhouse mirrors.;Improvisation;5;23
Crazy Cat Circus Extravaganza;Join the Crazy Cat Circus Extravaganza, where your charisma and creativity will shine as you perform amusing acts with talented and mischievous cats.;Charisma;3;20
Laughing Dance-off Showdown;Take part in the Laughing Dance-off Showdown, showcasing your charisma and dance moves as you compete in a side-splitting dance battle.;Charisma;4;22
Silly Animal Fashion Parade;Participate in the Silly Animal Fashion Parade, where your reliability and creativity will be tested in dressing up adorable animals in funny costumes.;Reliability;3;18
Goofy Clown Pie Toss;Engage in the Goofy Clown Pie Toss, using your charisma and precision to throw pies at a target while avoiding getting pied yourself.;Charisma;4;22
Whacky Costume Catwalk;Strut your stuff on the Whacky Costume Catwalk, showcasing your charisma as you model outrageous and funny costumes with confidence.;Charisma;5;24
Silly Street Prank Day;Celebrate Silly Street Prank Day, where your improvisation and humor will be put to the test as you pull off hilarious pranks on friends and neighbors.;Improvisation;4;20
Crazy Clown Roller Disco;Join the Crazy Clown Roller Disco, showcasing your charisma and roller-skating skills as you groove and spin around with fellow clowns.;Charisma;3;19
Hilarious Spoon Balancing Act;Perform the Hilarious Spoon Balancing Act, using your improvisation and balance to keep a spoon on your nose while entertaining the audience.;Improvisation;4;21
Silly Pie-Eating Contest;Compete in the Silly Pie-Eating Contest, showcasing your reliability and enthusiasm in devouring pies as quickly and humorously as possible.;Reliability;5;23
Laughing Comedy Sketch Show;Participate in the Laughing Comedy Sketch Show, where your charisma and acting talent will bring uproarious sketches to life on stage.;Charisma;4;20
Goofy Prank Call Showdown;Engage in the Goofy Prank Call Showdown, using your improvisation and wit to make funny prank calls to unsuspecting friends and family.;Improvisation;5;22
Silly Animal Olympics;Compete in the Silly Animal Olympics, showcasing your reliability and humor in a series of entertaining events inspired by animal movements.;Reliability;3;19
Crazy Clown Tug-of-War;Take part in the Crazy Clown Tug-of-War, where your charisma and strength will be put to the test in a hilarious and wacky battle of strength.;Charisma;4;22
Whimsical Face Painting Show;Host a Whimsical Face Painting Show, showcasing your creativity and charisma as you paint funny and imaginative designs on eager faces.;Charisma;5;24
Silly Chicken Parade;Join the Silly Chicken Parade, showcasing your charisma as you march and cluck like chickens with a hilarious group of participants.;Charisma;4;21
Laughing Yoga Comedy Hour;Attend the Laughing Yoga Comedy Hour, where your improvisation will lead a session of laughter-infused yoga exercises and humorous anecdotes.;Improvisation;5;23
Crazy Clown Balloon Battle;Engage in the Crazy Clown Balloon Battle, using your charisma and balloon-twisting skills to create funny and quirky balloon weapons for a playful battle.;Charisma;3;19
Silly Family Game Night;Host a Silly Family Game Night, showcasing your reliability in organizing a series of comical and entertaining games for family members to enjoy.;Reliability;4;21
Goofy Whipped Cream Pie Fight;Participate in the Goofy Whipped Cream Pie Fight, using your improvisation and quick reflexes to dodge and throw pies in a hilarious food fight.;Improvisation;5;24
Laughing Clown Dance Party;Join the Laughing Clown Dance Party, showcasing your charisma and dance moves as you boogie and laugh with fellow clowns and partygoers.;Charisma;4;20
Silly Obstacle Course Relay;Compete in the Silly Obstacle Course Relay, where your reliability and teamwork will be tested in a zany and entertaining relay race.;Reliability;3;18
Crazy Clown Olympics;Participate in the Crazy Clown Olympics, showcasing your charisma and comedic skills in a series of hilarious and amusing clown-themed challenges.;Charisma;4;20
Hilarious Animal Talent Show;Host a Hilarious Animal Talent Show, where your improvisation and creativity will shine as animals showcase their funniest and quirkiest talents.;Improvisation;5;23
Silly Dance Battle Royale;Engage in the Silly Dance Battle Royale, using your charisma and dance moves to outperform opponents in an entertaining and energetic dance-off.;Charisma;3;19
Goofy Magic Mishap Show;Perform in the Goofy Magic Mishap Show, where your reliability and humor will entertain the audience with a series of amusing magic trick mishaps.;Reliability;4;22
Laughing Mirror Mime Show;Take the stage in the Laughing Mirror Mime Show, showcasing your improvisation and charisma as you entertain with humorous and interactive mime performances.;Improvisation;5;23
Silly Pie Roulette Game;Play Silly Pie Roulette, showcasing your charisma and luck as participants spin a wheel to determine which hilarious pie they'll receive in the face.;Charisma;3;19
Crazy Clown Balancing Act;Perform the Crazy Clown Balancing Act, using your improvisation and balance to execute hilariously wobbly and precarious balancing stunts.;Improvisation;4;22
Hilarious April Fool's Day Pranks;Celebrate Hilarious April Fool's Day, where your creativity and charisma will be put to the test in pulling off the funniest and most clever pranks.;Charisma;5;24
Silly Puppet Karaoke Party;Host a Silly Puppet Karaoke Party, showcasing your reliability and entertainment skills as you sing along with puppet friends and interact with the audience.;Reliability;3;18
Laughing Duckling Parade;Join the Laughing Duckling Parade, showcasing your charisma as you lead a group of adorable ducklings in a charming and amusing parade.;Charisma;4;20
Goofy Spaghetti Eating Contest;Compete in the Goofy Spaghetti Eating Contest, using your improvisation and enthusiasm to eat spaghetti with the most entertaining and messy style.;Improvisation;5;22
Crazy Clown Photobomb Showdown;Participate in the Crazy Clown Photobomb Showdown, using your charisma and perfect timing to photobomb unsuspecting people in funny and creative ways.;Charisma;3;20
Hilarious Haunted House Tour;Guide visitors through the Hilarious Haunted House Tour, where your improvisation and humor will entertain and spook guests with funny scares and surprises.;Improvisation;4;22
Silly Face Swap Relay Race;Take part in the Silly Face Swap Relay Race, showcasing your reliability and teamwork as participants swap faces with hilarious masks in a race.;Reliability;3;18
Laughing Zumba Party;Join the Laughing Zumba Party, where your charisma will lead a lively and laughter-filled Zumba session to get everyone dancing and laughing.;Charisma;4;20
Goofy Clown Fashion Show;Participate in the Goofy Clown Fashion Show, showcasing your improvisation and style as you strut and model an array of funny and outrageous clown outfits.;Improvisation;5;22
Silly Animal Language Challenge;Engage in the Silly Animal Language Challenge, using your charisma and creativity to communicate with animal sounds and gestures in a hilarious guessing game.;Charisma;3;19
Crazy Inflatable Obstacle Race;Race in the Crazy Inflatable Obstacle Race, showcasing your reliability and humor as you navigate wacky and bouncy inflatable obstacles.;Reliability;4;21
Hilarious Clown Juggling Show;Perform in the Hilarious Clown Juggling Show, using your charisma and juggling skills to entertain the audience with funny and surprising juggling acts.;Charisma;5;24
Silly Car Horn Symphony;Participate in the Silly Car Horn Symphony, where your improvisation and musical creativity will compose a comical and entertaining symphony using car horns.;Improvisation;4;21
Laughing Scavenger Hunt;Embark on a Laughing Scavenger Hunt, where your charisma and teamwork will lead you to find and collect funny and quirky items in a race against time.;Charisma;3;18
Goofy Clown Talent Show;Host a Goofy Clown Talent Show, showcasing your reliability and creativity as fellow clowns demonstrate their funniest and most unique talents.;Reliability;4;21
Silly Water Balloon Olympics;Compete in the Silly Water Balloon Olympics, using your charisma and aim to participate in water balloon challenges and games filled with laughter.;Charisma;5;23
Crazy Clown Puppet Theater;Perform in the Crazy Clown Puppet Theater, where your improvisation and puppetry skills will entertain the audience with humorous and imaginative puppet shows.;Improvisation;4;22
Hilarious Balloon Animal Workshop;Host a Hilarious Balloon Animal Workshop, showcasing your charisma and balloon-twisting skills as you teach participants to create funny and adorable balloon animals.;Charisma;3;20
Silly Impersonation Battle;Engage in the Silly Impersonation Battle, using your charisma and mimicry talents to impersonate famous characters in a hilarious and entertaining showdown.;Charisma;4;20
Laughing Face Mask Dance-off;Join the Laughing Face Mask Dance-off, showcasing your improvisation and dance moves as you groove and laugh while wearing funny face masks.;Improvisation;5;24
Goofy Clown Olympics;Participate in the Goofy Clown Olympics, showcasing your reliability and humor in a series of clown-themed challenges and competitions.;Reliability;3;18
Hilarious Fake Mustache Parade;Join the Hilarious Fake Mustache Parade, showcasing your charisma as participants don silly and amusing fake mustaches for a delightful and lighthearted parade.;Charisma;4;22
Silly Pie Throwing Relay;Take part in the Silly Pie Throwing Relay, showcasing your reliability and teamwork as participants throw pies to each other in a funny and messy relay.;Reliability;5;23
Laughing Bubble Wrap Stomp;Stomp on the Laughing Bubble Wrap, where your charisma and enthusiasm will lead a joyous and giggly experience of popping bubble wrap.;Charisma;4;21
Goofy Face Painting Race;Compete in the Goofy Face Painting Race, showcasing your improvisation and artistic skills as you paint funny and imaginative designs on participants' faces.;Improvisation;5;24
Silly Animal Impersonation Parade;Join the Silly Animal Impersonation Parade, where your charisma and creativity will shine as participants dress up and imitate funny animal characters.;Charisma;3;19
Crazy Clown Prank Show;Perform in the Crazy Clown Prank Show, using your improvisation and humor to entertain the audience with a series of hilarious and surprising pranks.;Improvisation;4;21
Hilarious Rubber Chicken Relay;Participate in the Hilarious Rubber Chicken Relay, showcasing your reliability and humor as participants pass rubber chickens in a comical and entertaining relay race.;Reliability;3;18
Silly Dance Freeze Party;Join the Silly Dance Freeze Party, where your charisma and dance moves will entertain guests as they dance and freeze to funny and unexpected cues.;Charisma;4;21
Laughing Potato Sack Race;Race in the Laughing Potato Sack Race, showcasing your improvisation and humor as you hop and compete in a comical and spirited potato sack race.;Improvisation;5;23
