Event_Title;Event_Description;Relevant_Quality;Event_Duration;Cost_Per_Day
Outdoor Music Festival;Be part of the outdoor music festival as the lively mascot. Dance with the crowd, entertain festival-goers, and create a vibrant atmosphere throughout the event.;Charisma;3;40
Children's Hospital Visit;Brighten the day of young patients at the children's hospital. Engage with children, distribute gifts, and bring joy with your charismatic presence.;Charisma;1;20
Community Fundraising Walk;Join the community fundraising walk as the motivating mascot. Cheer on the participants, encourage donations, and inspire with your energetic persona.;Charisma;2;15
Local Carnival Parade;Take part in the local carnival parade as the colorful mascot. Interact with the audience, perform dance routines, and create a festive ambiance during the parade.;Charisma,Improvisation;4;30
Product Launch Party;Celebrate the launch of a new product at the party. Engage with guests, create photo opportunities, and bring excitement with your charismatic persona.;Charisma;1;25
Beach Party Event;Join the beach party event as the fun-loving mascot. Dance with beachgoers, play games, and create a lively atmosphere by the shore.;Charisma;2;20
Local Community Sports Tournament;Support the local sports tournament as the enthusiastic mascot. Interact with players, cheer on teams, and create a spirited atmosphere.;Charisma;1;10
Amusement Park Adventure Day;Experience an adventure day at the amusement park. Interact with visitors, pose for photos, and create thrilling memories with your charismatic presence.;Charisma;5;35
Community Picnic in the Park;Attend the community picnic as the lovable mascot. Engage with families, lead games, and create a warm and inviting atmosphere.;Charisma;2;20
Summer Music Concert Series;Be part of the summer music concert series. Dance with the crowd, entertain music lovers, and create an unforgettable experience.;Charisma;3;40
Local Food Fair;Bring excitement to the local food fair. Interact with food vendors, engage with visitors, and create a festive atmosphere with your energetic persona.;Charisma;2;25
Public Library Storytelling Event;Join the public library storytelling event as the fun mascot. Interact with children, participate in storytelling, and make reading an enjoyable adventure.;Charisma;1;15
Holiday Theme Park Spectacular;Celebrate the holidays at the theme park spectacular. Interact with guests, pose for photos, and create a magical atmosphere with your improvisational skills.;Improvisation;4;35
Charity Golf Tournament;Support the charity golf tournament as the motivating mascot. Engage with golfers, cheer on participants, and create a positive and inspiring atmosphere.;Charisma;2;30
Pet Adoption Fair;Promote pet adoption at the fair as the adorable mascot. Interact with potential adopters, pose for photos, and bring joy to the event.;Charisma;3;20
Local Community Arts Festival;Join the arts festival as the vibrant mascot. Interact with artists, engage with attendees, and create a colorful and inspiring atmosphere.;Charisma;3;25
Outdoor Yoga and Wellness Event;Support the outdoor wellness event as the calming mascot. Interact with participants, promote relaxation, and create a peaceful ambiance.;Charisma;1;15
School Science Experiment Day;Add a touch of fun to the school science experiment day. Engage with students, perform science-themed skits, and make learning an entertaining experience.;Charisma;1;10
Community Garden Party;Attend the community garden party as the cheerful mascot. Engage with guests, pose for photos, and create a delightful and vibrant atmosphere.;Charisma;2;20
Local Artisan Market;Bring excitement to the artisan market. Interact with vendors, engage with shoppers, and create a festive atmosphere with your energetic persona.;Charisma;1;10
City Marathon Expo;Participate in the city marathon expo as the motivating mascot. Interact with runners, provide high-fives, and inspire participants with your energetic presence.;Charisma;2;25
Public Park Cleanup Day;Join the public park cleanup day as the eco-conscious mascot. Motivate volunteers, interact with families, and bring enthusiasm to the event.;Charisma;1;15
Local Craft Beer Festival;Be part of the local craft beer festival. Interact with beer enthusiasts, pose for photos, and create a lively and entertaining atmosphere.;Charisma;2;30
Children's Play Area Opening;Celebrate the opening of a children's play area. Engage with young visitors, participate in games, and create a playful and fun atmosphere.;Charisma;1;20
Community Talent Show;Host the community talent show as the entertaining mascot. Engage with performers, interact with the audience, and create a lively and supportive environment.;Charisma;2;15
Senior Citizen Center Visit;Brighten the day of senior citizens at the community center. Engage with residents, participate in activities, and bring joy with your charismatic presence.;Charisma;1;10
Local Environmental Cleanup Event;Support the local environmental cleanup event as the eco-conscious mascot. Interact with participants, promote sustainable practices, and create a positive impact.;Charisma;3;25
Youth Sports Camp;Bring excitement to the youth sports camp. Engage with young athletes, participate in drills, and create a fun and motivational atmosphere.;Charisma;2;20
Food Bank Fundraising Drive;Support the food bank fundraising drive as the caring mascot. Interact with donors, encourage donations, and create a compassionate and giving atmosphere.;Charisma;1;10
Farmers Market Promotion Day;Promote the farmers market as the friendly mascot. Engage with vendors, interact with shoppers, and promote fresh and local produce with your lively presence.;Charisma;2;20
School End-of-Year Carnival;Add fun to the school end-of-year carnival. Engage with students, lead games, and create a celebratory atmosphere.;Charisma;2;15
Local Fire Station Open House;Join the local fire station open house as the friendly mascot. Interact with children, participate in fire safety demonstrations, and create a welcoming environment.;Charisma;1;15
Community Theater Play Premiere;Attend the community theater play premiere as the beloved mascot. Engage with the audience, pose for photos, and create a lively atmosphere during intermissions.;Charisma;3;30
Farm-to-Table Festival;Bring excitement to the farm-to-table festival. Interact with farmers, engage with visitors, and create a festive atmosphere with your energetic persona.;Charisma;2;25
Local Animal Shelter Adoption Day;Promote pet adoption at the shelter as the adorable mascot. Interact with potential adopters, pose for photos, and bring joy to the event.;Charisma;2;20
Community Cultural Fair;Join the community cultural fair as the vibrant mascot. Interact with participants, engage with visitors, and celebrate diversity and unity.;Charisma;3;35
School Spirit Week Pep Rally;Show your school spirit during Spirit Week. Perform at pep rallies, engage with students, and rally support for sports teams and school events.;Charisma;1;10
Summer Camp Talent Show;Add a touch of fun to the summer camp talent show. Engage with campers, perform entertaining acts, and create a memorable and supportive environment.;Charisma;2;15
Public Zoo Exhibit Opening;Celebrate the opening of a new zoo exhibit. Interact with visitors, pose for photos, and create an educational and entertaining experience.;Charisma;3;30
Local Community Film Screening;Be part of the community film screening as the entertaining mascot. Engage with moviegoers, pose for photos, and create a fun and memorable movie night.;Charisma;1;10
Neighborhood Block Party;Join a neighborhood block party as the vibrant mascot. Interact with residents, lead games, and create a lively and inclusive community atmosphere.;Charisma;2;20
Health and Wellness Expo;Promote health and wellness at an expo as the enthusiastic mascot. Engage with participants, lead fitness activities, and create a vibrant atmosphere.;Charisma;3;35
Charity Auction Gala;Attend a charity auction gala as the captivating mascot. Interact with bidders, entertain guests, and create a memorable experience during the fundraising event.;Charisma;2;30
Pet Park Opening;Celebrate the opening of a new pet park. Interact with pet owners, participate in pet-friendly activities, and create a playful and welcoming atmosphere.;Charisma;1;20
Local Art Gallery Exhibition Opening;Enhance the art gallery exhibition opening with your presence. Interact with art enthusiasts, strike playful poses, and create a vibrant ambiance.;Charisma;3;25
Children's Hospital Fundraising Gala;Support the children's hospital fundraising gala as the caring mascot. Engage with donors, entertain guests, and create a heartwarming and memorable event.;Charisma;2;30
City Green Initiative Launch;Join the city green initiative launch as the eco-conscious mascot. Interact with attendees, promote sustainable practices, and create a positive impact.;Charisma;1;15
School Career Day;Add excitement to the school career day. Engage with students, share career insights, and inspire young minds with your charismatic presence.;Charisma;1;10
Local Community Music Jam;Be part of the community music jam as the energetic mascot. Dance with the crowd, entertain musicians, and create a lively and interactive musical experience.;Charisma;2;20
Public Park Playground Opening;Celebrate the opening of a new public park playground. Engage with families, participate in games, and create a playful and fun-filled atmosphere.;Charisma;1;15
Environmental Awareness Workshop;Support the environmental awareness workshop as the eco-conscious mascot. Interact with participants, promote sustainable practices, and create a positive impact.;Charisma;2;25
Public Library Summer Reading Kick-Off;Join the public library summer reading kick-off as the fun mascot. Interact with young readers, participate in storytelling, and make reading an enjoyable adventure.;Charisma;1;10
Community Sports League Championship;Support the community sports league championship as the motivating mascot. Engage with athletes, cheer on teams, and create a spirited and competitive atmosphere.;Charisma;3;30
Local Charity Fun Fair;Bring excitement to the local charity fun fair. Interact with visitors, lead games, and create a festive atmosphere with your energetic persona.;Charisma;2;20
City Music and Arts Festival;Be part of the city music and arts festival. Dance with the crowd, entertain festival-goers, and create a vibrant and creative atmosphere.;Charisma;3;35
Community Park Cleanup Day;Join the community park cleanup day as the eco-conscious mascot. Motivate volunteers, interact with families, and bring enthusiasm to the event.;Charisma;1;15
Children's Educational Workshop;Add fun to the children's educational workshop. Engage with young learners, participate in activities, and create an inspiring and interactive learning experience.;Charisma;2;20
Local Cultural Dance Performance;Attend the local cultural dance performance as the captivating mascot. Engage with the audience, pose for photos, and create a lively and enriching cultural experience.;Charisma;1;10
Youth Leadership Conference;Support the youth leadership conference as the inspiring mascot. Engage with young leaders, participate in workshops, and create a motivating and empowering atmosphere.;Charisma;3;25
Community Book Club Gathering;Join the community book club gathering as the fun mascot. Engage with book enthusiasts, participate in discussions, and make reading a social and enjoyable experience.;Charisma;2;20
School Field Day Event;Add excitement to the school field day event. Engage with students, lead games, and create a fun and competitive atmosphere.;Charisma;1;10
Local Environmental Cleanup Day;Support the local environmental cleanup day as the eco-conscious mascot. Interact with participants, promote sustainable practices, and create a positive impact.;Charisma;2;25
Youth Sports League Awards Ceremony;Attend the youth sports league awards ceremony as the charismatic mascot. Interact with young athletes, pose for photos, and bring enthusiasm to the celebration.;Charisma;1;15
Public Museum Exhibit Opening;Celebrate the opening of a new public museum exhibit. Interact with visitors, pose for photos, and create an educational and engaging experience.;Charisma;3;30
Family Movie Night at the Park;Join the family movie night at the park as the entertaining mascot. Interact with moviegoers, pose for photos, and create a fun and memorable movie experience.;Charisma;1;10
Neighborhood Community Center Launch;Be part of the neighborhood community center launch. Engage with residents, participate in activities, and create a welcoming and inclusive environment.;Charisma;2;20
Health and Fitness Expo;Promote health and fitness at an expo as the enthusiastic mascot. Engage with participants, lead fitness activities, and create a vibrant atmosphere.;Charisma;3;35
Charity Gala Dinner;Attend a charity gala dinner as the captivating mascot. Interact with donors, entertain guests, and create a memorable experience during the fundraising event.;Charisma;2;30
Pet-friendly Park Cleanup Day;Support the pet-friendly park cleanup day as the caring mascot. Interact with pet owners, promote responsible pet ownership, and create a joyful and pet-friendly atmosphere.;Charisma;1;15
Local History Museum Exhibit Opening;Enhance the history museum exhibit opening with your presence. Interact with visitors, pose for photos, and create an educational and engaging experience.;Charisma;3;25
Community Dance Workshop;Join the community dance workshop as the energetic mascot. Dance with participants, lead dance routines, and create a lively and inclusive dance experience.;Charisma;1;10
Public Beach Cleanup Event;Support the public beach cleanup event as the eco-conscious mascot. Motivate volunteers, interact with families, and bring enthusiasm to the event.;Charisma;2;20
Community Arts and Crafts Fair;Bring excitement to the community arts and crafts fair. Interact with artisans, engage with visitors, and create a creative and festive atmosphere with your energetic persona.;Charisma;2;25
City Sports Festival;Be part of the city sports festival. Interact with athletes, cheer on participants, and create a spirited and celebratory atmosphere.;Charisma;3;30
Local Environmental Awareness Campaign;Promote environmental awareness at the local campaign as the eco-conscious mascot. Interact with participants, promote sustainable practices, and create a positive impact.;Charisma;1;15
Youth Summer Camp Talent Show;Add a touch of fun to the youth summer camp talent show. Engage with campers, perform entertaining acts, and create a memorable and supportive environment.;Charisma;2;20
Community Concert in the Park;Join the community concert in the park as the lively mascot. Dance with the crowd, entertain concert-goers, and create a joyful and musical experience.;Charisma;1;10
Public Library Book Sale;Be part of the public library book sale as the friendly mascot. Interact with book enthusiasts, pose for photos, and create a fun and engaging book-buying experience.;Charisma;2;20
Local Environmental Cleanup Drive;Support the local environmental cleanup drive as the eco-conscious mascot. Interact with participants, promote sustainable practices, and create a positive impact.;Charisma;1;15
City Youth Arts Showcase;Celebrate the city youth arts showcase as the inspiring mascot. Engage with young artists, interact with the audience, and create a supportive and creative environment.;Charisma;3;25
Community Volunteer Appreciation Event;Attend the community volunteer appreciation event as the caring mascot. Engage with volunteers, show gratitude, and create a warm and thankful atmosphere.;Charisma;1;10
Youth Leadership Workshop;Support the youth leadership workshop as the empowering mascot. Engage with young leaders, participate in activities, and create a motivating and inspiring atmosphere.;Charisma;2;25
Public Park Fitness Class;Join the public park fitness class as the energetic mascot. Engage with participants, lead fitness routines, and create a fun and motivating workout session.;Charisma;1;10
Local Science Fair;Add a touch of fun to the local science fair. Engage with students, perform science-themed skits, and make learning an entertaining experience.;Charisma;2;20
Community Garden Planting Day;Support the community garden planting day as the eco-conscious mascot. Interact with participants, promote gardening practices, and create a positive and green atmosphere.;Charisma;1;15
Children's Educational Puppet Show;Be part of the children's educational puppet show as the entertaining mascot. Interact with young audiences, participate in puppetry, and create an engaging and educational experience.;Charisma;2;20
City Sports League Kick-Off Event;Celebrate the city sports league kick-off event as the motivating mascot. Engage with athletes, encourage team spirit, and create a spirited and competitive atmosphere.;Charisma;1;10
Local Charity Fun Run;Support the local charity fun run as the inspiring mascot. Engage with runners, cheer on participants, and create a positive and charitable atmosphere.;Charisma;2;25
Public Museum Workshop for Kids;Join the public museum workshop for kids as the fun mascot. Engage with young learners, participate in activities, and create an interactive and educational experience.;Charisma;1;15
Community Sports Clinic;Support the community sports clinic as the enthusiastic mascot. Engage with young athletes, participate in drills, and create a fun and encouraging environment.;Charisma;2;20
Charity Fashion Show Fundraiser;Attend a charity fashion show fundraiser as the captivating mascot. Interact with guests, pose for photos, and create a memorable experience during the fundraising event.;Charisma;3;30
Public Park Playground Clean-Up Day;Join the public park playground clean-up day as the caring mascot. Interact with families, participate in games, and create a safe and enjoyable play environment.;Charisma;1;10
Local Art Exhibition Opening Night;Enhance the local art exhibition opening night with your presence. Interact with art enthusiasts, strike playful poses, and create a vibrant ambiance.;Charisma;2;20
Children's Storytelling Festival;Be part of the children's storytelling festival as the captivating mascot. Engage with young readers, participate in storytelling, and make reading an enjoyable adventure.;Charisma;1;15
Community Science Fair;Add excitement to the community science fair. Engage with students, perform science-themed skits, and make learning an entertaining experience.;Charisma;2;25
City Park Renovation Fundraiser;Support the city park renovation fundraiser as the inspiring mascot. Engage with donors, entertain guests, and create a positive and charitable atmosphere.;Charisma;1;10
Local Music and Arts Exhibition;Join the local music and arts exhibition as the lively mascot. Dance with the crowd, entertain attendees, and create a vibrant and creative atmosphere.;Charisma;2;20
Youth Sports League Closing Ceremony;Attend the youth sports league closing ceremony as the charismatic mascot. Interact with young athletes, pose for photos, and bring enthusiasm to the celebration.;Charisma;3;25
Public Library Family Game Night;Join the public library family game night as the fun mascot. Interact with families, participate in games, and create a fun and enjoyable evening.;Charisma;1;10
Neighborhood Community Picnic;Bring excitement to the neighborhood community picnic. Engage with residents, lead games, and create a friendly and inclusive community atmosphere.;Charisma;2;20
Health and Wellness Seminar;Promote health and wellness at a seminar as the enthusiastic mascot. Engage with participants, lead fitness activities, and create a vibrant and empowering atmosphere.;Charisma;3;30
Charity Gala Auction;Attend a charity gala auction as the captivating mascot. Interact with bidders, entertain guests, and create a memorable experience during the fundraising event.;Charisma;1;10
Local Pet Adoption Day;Support pet adoption at the local event as the adorable mascot. Interact with potential adopters, pose for photos, and bring joy to the event.;Charisma;2;20
Community Cultural Festival;Join the community cultural festival as the vibrant mascot. Engage with participants, interact with visitors, and celebrate diversity and unity.;Charisma;3;35
City Parade Float Decoration Day;Participate in decorating the city parade float as the creative mascot. Engage with volunteers, contribute ideas, and create a stunning and eye-catching float.;Improvisation;1;10
Children's Museum Workshop;Add fun to the children's museum workshop. Engage with young learners, participate in activities, and create an interactive and educational experience.;Charisma;2;20
Local Environmental Cleanup Drive;Support the local environmental cleanup drive as the eco-conscious mascot. Interact with participants, promote sustainable practices, and create a positive impact.;Charisma;1;15
Youth Leadership Workshop;Support the youth leadership workshop as the empowering mascot. Engage with young leaders, participate in activities, and create a motivating and inspiring atmosphere.;Charisma;2;25
Public Park Fitness Class;Join the public park fitness class as the energetic mascot. Engage with participants, lead fitness routines, and create a fun and motivating workout session.;Charisma;1;10
Local Science Fair;Add a touch of fun to the local science fair. Engage with students, perform science-themed skits, and make learning an entertaining experience.;Charisma;2;20
Community Garden Planting Day;Support the community garden planting day as the eco-conscious mascot. Interact with participants, promote gardening practices, and create a positive and green atmosphere.;Charisma;1;15
Children's Educational Puppet Show;Be part of the children's educational puppet show as the entertaining mascot. Interact with young audiences, participate in puppetry, and create an engaging and educational experience.;Charisma;2;20
City Sports League Kick-Off Event;Celebrate the city sports league kick-off event as the motivating mascot. Engage with athletes, encourage team spirit, and create a spirited and competitive atmosphere.;Charisma;1;10
Local Charity Fun Run;Support the local charity fun run as the inspiring mascot. Engage with runners, cheer on participants, and create a positive and charitable atmosphere.;Charisma;2;25
Public Museum Workshop for Kids;Join the public museum workshop for kids as the fun mascot. Engage with young learners, participate in activities, and create an interactive and educational experience.;Charisma;1;15
Community Sports Clinic;Support the community sports clinic as the enthusiastic mascot. Engage with young athletes, participate in drills, and create a fun and encouraging environment.;Charisma;2;20
Charity Fashion Show Fundraiser;Attend a charity fashion show fundraiser as the captivating mascot. Interact with guests, pose for photos, and create a memorable experience during the fundraising event.;Charisma;3;30
Public Park Playground Clean-Up Day;Join the public park playground clean-up day as the caring mascot. Interact with families, participate in games, and create a safe and enjoyable play environment.;Charisma;1;10
Local Art Exhibition Opening Night;Enhance the local art exhibition opening night with your presence. Interact with art enthusiasts, strike playful poses, and create a vibrant ambiance.;Charisma;2;20
Children's Storytelling Festival;Be part of the children's storytelling festival as the captivating mascot. Engage with young readers, participate in storytelling, and make reading an enjoyable adventure.;Charisma;1;15
Community Science Fair;Add excitement to the community science fair. Engage with students, perform science-themed skits, and make learning an entertaining experience.;Charisma;2;25
City Park Renovation Fundraiser;Support the city park renovation fundraiser as the inspiring mascot. Engage with donors, entertain guests, and create a positive and charitable atmosphere.;Charisma;1;10
Local Music and Arts Exhibition;Join the local music and arts exhibition as the lively mascot. Dance with the crowd, entertain attendees, and create a vibrant and creative atmosphere.;Charisma;2;20
Youth Sports League Closing Ceremony;Attend the youth sports league closing ceremony as the charismatic mascot. Interact with young athletes, pose for photos, and bring enthusiasm to the celebration.;Charisma;3;25
Public Library Family Game Night;Join the public library family game night as the fun mascot. Interact with families, participate in games, and create a fun and enjoyable evening.;Charisma;1;10
Neighborhood Community Picnic;Bring excitement to the neighborhood community picnic. Engage with residents, lead games, and create a friendly and inclusive community atmosphere.;Charisma;2;20
Health and Wellness Seminar;Promote health and wellness at a seminar as the enthusiastic mascot. Engage with participants, lead fitness activities, and create a vibrant and empowering atmosphere.;Charisma;3;30
Charity Gala Auction;Attend a charity gala auction as the captivating mascot. Interact with bidders, entertain guests, and create a memorable experience during the fundraising event.;Charisma;1;10
Local Pet Adoption Day;Support pet adoption at the local event as the adorable mascot. Interact with potential adopters, pose for photos, and bring joy to the event.;Charisma;2;20
Community Cultural Festival;Join the community cultural festival as the vibrant mascot. Engage with participants, interact with visitors, and celebrate diversity and unity.;Charisma;3;35
City Parade Float Decoration Day;Participate in decorating the city parade float as the creative mascot. Engage with volunteers, contribute ideas, and create a stunning and eye-catching float.;Improvisation;1;10
