Event_Title;Event_Description;Relevant_Quality;Event_Duration;Cost_Per_Day
The Spirit Public Viewing;Be the highlight at our public viewing! Delight the audience with your spontaneous style to maintain the atmosphere and entertain the spectators.;Improvisation;5;25
VIP Attendant and Event Ambassador;You are the face of our event for VIPs. Be punctual, friendly, and ensure that our guests feel appreciated.;Reliability;3;20
Children's Darling and Enchanter;Enchant our youngest visitors with your charm and playful interaction. Make children laugh and give them unforgettable moments.;Charisma;4;22
Street Parade Star and Master of Spontaneity;Be a star in our lively street parade! With your improvisational skills, captivate the crowd and create exhilarating entertainment.;Improvisation;6;18
Event Announcer and Organizational Genius;As the event announcer, provide important information and ensure a smooth flow. Be reliable and precise to perfect the event.;Reliability;2;30
Time Travel Treasure Hunt;Embark on a thrilling time travel treasure hunt where improvisation is key to solving historical riddles and challenges from different eras.;Improvisation;6;28
Galactic Explorer's Adventure;Join the Galactic Explorer's Adventure, where your charisma will be tested as you entertain alien creatures on an interstellar journey.;Charisma;5;24
Reliability Olympics;Compete in the Reliability Olympics, showcasing your reliability and precision in a series of challenging tasks and events.;Reliability;4;22
Mystery Masquerade Ball;Attend the Mystery Masquerade Ball and use your improvisation skills to mingle with masked guests, uncover secrets, and solve a thrilling mystery.;Improvisation;3;20
Enchanted Forest Quest;Embark on an Enchanted Forest Quest, where your charisma will charm mythical creatures and characters in a magical realm.;Charisma;4;25
Steampunk Invention Expo;Showcase your creativity and reliability at the Steampunk Invention Expo, where you'll present your innovative steam-powered contraptions.;Reliability;5;28
Circus Spectacle Showdown;Compete in the Circus Spectacle Showdown, where your improvisation and charisma will shine during extraordinary circus performances.;Improvisation;6;26
Time Management Escape Room;Test your reliability and precision in the Time Management Escape Room, solving time-sensitive puzzles to escape from different historical periods.;Reliability;4;23
Fairy Tale Festival Parade;Be the star of the Fairy Tale Festival Parade, where your charisma will enchant spectators as you bring beloved fairy tale characters to life.;Charisma;3;21
AI vs. Human Improv Battle;Participate in the AI vs. Human Improv Battle, where your improvisation skills will be put to the test against an artificial intelligence opponent.;Improvisation;5;27
Underwater Extravaganza;Dive into the Underwater Extravaganza, where your charisma will mesmerize sea creatures and underwater spectators alike.;Charisma;4;23
Stealthy Spy Mission;Embark on a Stealthy Spy Mission, testing your improvisation and reliability as you navigate high-stakes espionage and intrigue.;Improvisation;6;26
Galactic Chef Challenge;Show off your improvisation skills as a Galactic Chef, competing in interstellar cooking challenges for alien food enthusiasts.;Improvisation;5;24
Time-Bending Music Concert;Take the stage at the Time-Bending Music Concert, where your charisma will captivate the audience as you play tunes from different eras.;Charisma;3;20
Legendary Creatures Safari;Embark on a Legendary Creatures Safari, using your reliability and precision to capture magical creatures for a mythical wildlife reserve.;Reliability;4;21
Robot Rebellion Battle;Join the Robot Rebellion Battle, where your charisma will inspire a team of rebels to stand against a rogue army of malfunctioning robots.;Charisma;5;25
Wild West Showdown;Test your improvisation and reliability in the Wild West Showdown, a fast-paced competition of cowboy skills and dueling showdowns.;Improvisation;4;22
Futuristic Fashion Show;Be the star model at the Futuristic Fashion Show, showcasing your charisma as you strut in cutting-edge fashion designs.;Charisma;3;19
Secret Agent Escape Room;Put your reliability and precision to the test in the Secret Agent Escape Room, solving espionage-themed puzzles to uncover the truth.;Reliability;5;27
Fantasy Dragon Racing;Compete in the adrenaline-pumping Fantasy Dragon Racing tournament, where improvisation and reliability are crucial in this mythical sport.;Improvisation;6;29
Pixelated Adventure Quest;Embark on a Pixelated Adventure Quest, using your charisma to charm retro video game characters in a nostalgic 8-bit world.;Charisma;4;23
Time Traveler's Dilemma;Solve the Time Traveler's Dilemma, a mind-bending puzzle challenge that demands improvisation and reliable decision-making.;Reliability;6;26
Medieval Jousting Tournament;Participate in the Medieval Jousting Tournament, where your charisma will captivate the crowd during thrilling knightly duels.;Charisma;3;21
Superhero Training Bootcamp;Enroll in the Superhero Training Bootcamp, where your reliability will be put to the test in a series of heroic challenges.;Reliability;4;22
Extraterrestrial Art Expo;Showcase your creativity and improvisation at the Extraterrestrial Art Expo, where alien art enthusiasts await your out-of-this-world masterpieces.;Improvisation;5;25
Time Bender's Puzzle Palace;Navigate through the Time Bender's Puzzle Palace, where your charisma will help you enlist the aid of ancient puzzle guardians.;Charisma;6;28
Enchanted Garden Soiree;Be the charismatic host of the Enchanted Garden Soiree, where you'll entertain mystical creatures and ethereal guests.;Charisma;3;20
Time Loop Adventure;Embark on a mind-bending Time Loop Adventure, where your reliability will be essential in solving complex temporal puzzles.;Reliability;6;24
Alien Language Diplomacy;Utilize your charisma to negotiate intergalactic treaties in the Alien Language Diplomacy summit, bridging communication gaps with extraterrestrial beings.;Charisma;4;22
Time-Traveling Circus Extravaganza;Join the Time-Traveling Circus Extravaganza, where your charisma will entertain audiences across different historical periods with mesmerizing acts.;Charisma;6;26
High-Tech Escape Room Challenge;Test your improvisation and reliability in the High-Tech Escape Room Challenge, where you'll need to solve futuristic puzzles to escape.;Improvisation;5;23
Artificial Intelligence Art Showdown;Compete in the Artificial Intelligence Art Showdown, demonstrating your creativity and improvisation as you collaborate with AI to create innovative artworks.;Improvisation;4;21
Magical Potion Brewing Competition;Showcase your reliability and precision in the Magical Potion Brewing Competition, where you'll concoct spells and elixirs under time pressure.;Reliability;3;19
Ancient Mythology Role-Playing Adventure;Embark on an Ancient Mythology Role-Playing Adventure, where your charisma will immerse you in legendary tales as you interact with mythical beings.;Charisma;5;24
Time-Warping Dance Battle;Join the Time-Warping Dance Battle, where your charisma and improvisation will impress the judges as you dance through different eras.;Charisma;4;22
Interdimensional Cuisine Cook-Off;Take part in the Interdimensional Cuisine Cook-Off, using your creativity and improvisation to prepare dishes from parallel universes.;Improvisation;6;25
Steampunk Robot Showdown;Test your reliability and precision in the Steampunk Robot Showdown, where you'll pilot intricate steam-powered robots in thrilling duels.;Reliability;5;23
Astro-Explorer's Galactic Safari;Embark on an Astro-Explorer's Galactic Safari, where your charisma will captivate alien species as you document unique interstellar wildlife.;Charisma;4;21
Enchanted Music Box Melodies;Use your improvisation and reliability to repair an Enchanted Music Box, uncovering the lost melodies that can restore harmony to a magical realm.;Improvisation;5;24
Time Detective Mystery Case;Solve the Time Detective Mystery Case, relying on your charisma to interrogate suspects and uncover secrets across different time periods.;Charisma;6;26
Cyberpunk VR Racing Tournament;Compete in the Cyberpunk VR Racing Tournament, where your reliability and precision will determine victory in high-speed futuristic races.;Reliability;4;22
Jurassic Dino Park Adventure;Embark on a Jurassic Dino Park Adventure, where your charisma will impress dinosaur trainers and visitors in a thrilling prehistoric park.;Charisma;3;20
Techno Wizard's Coding Challenge;Showcase your creativity and improvisation in the Techno Wizard's Coding Challenge, where you'll program AI companions to tackle complex quests.;Improvisation;6;28
Fantasy Realm Chess Masters;Test your reliability and precision in the Fantasy Realm Chess Masters, where your strategic skills will be challenged against magical opponents.;Reliability;5;25
Retro Arcade Time Warp;Experience the Retro Arcade Time Warp, where your charisma will draw crowds as you excel in classic arcade games from different decades.;Charisma;4;23
Time Travel Photography Expedition;Embark on a Time Travel Photography Expedition, using your charisma to capture stunning shots of historical events and ancient civilizations.;Charisma;3;19
Neon Noir Mystery Noir;Immerse yourself in the Neon Noir Mystery Noir, using your improvisation and reliability to solve a gripping cyberpunk detective case.;Improvisation;5;23
Aquatic Fantasy Art Gala;Showcase your creativity and improvisation in the Aquatic Fantasy Art Gala, where you'll create underwater masterpieces for enchanted art enthusiasts.;Improvisation;4;21
Mars Colony Builder Challenge;Lead the Mars Colony Builder Challenge, demonstrating your reliability and precision as you establish a sustainable colony on the Red Planet.;Reliability;6;27
The Great Banana Peel Race;Join the hilarity of The Great Banana Peel Race, where your improvisation will come in handy to navigate slippery obstacles.;Improvisation;4;20
Clumsy Clown Showdown;Compete in the Clumsy Clown Showdown, showcasing your charisma as you perform slapstick acts and silly mishaps in a circus-style showdown.;Charisma;3;18
Penguin Waddle Olympics;Participate in the Penguin Waddle Olympics, where your reliability will be tested in waddling races and quirky penguin-themed challenges.;Reliability;2;15
Goofy Giggles Comedy Club;Take the stage at the Goofy Giggles Comedy Club, using your improvisation to entertain the audience with hilarious jokes and antics.;Improvisation;5;22
Silly Hat Fashion Parade;Be the center of attention in the Silly Hat Fashion Parade, strutting your charisma while showcasing the quirkiest and most absurd headwear.;Charisma;3;19
Crazy Cat Lady's Adventure;Embark on the Crazy Cat Lady's Adventure, where your reliability and precision will be put to the test while rescuing mischievous feline friends.;Reliability;4;21
Alien Karaoke Extravaganza;Unleash your charisma and entertain alien spectators at the Alien Karaoke Extravaganza, singing and dancing to funky intergalactic tunes.;Charisma;5;24
Unicorn Rodeo Showdown;Test your improvisation in the Unicorn Rodeo Showdown, as you ride whimsical unicorns in hilarious rodeo-style challenges.;Improvisation;4;23
Zany Obstacle Course Chaos;Navigate through the Zany Obstacle Course Chaos, where your reliability will be challenged in a course filled with wacky traps and surprises.;Reliability;3;18
Comical Mime Street Parade;Join the Comical Mime Street Parade, using your charisma to entertain spectators with silent but hilarious mime performances.;Charisma;2;17
Sloppy Pie Eating Contest;Compete in the Sloppy Pie Eating Contest, showcasing your improvisation and charisma as you devour messy pies with gusto.;Improvisation;4;20
Cheesy Joke Stand-Up Show;Take the mic at the Cheesy Joke Stand-Up Show, where your charisma will delight the audience with a series of intentionally cheesy jokes.;Charisma;3;19
Funny Farm Animal Olympics;Participate in the Funny Farm Animal Olympics, where your reliability will be tested in farm-themed events with unpredictable and humorous twists.;Reliability;5;22
Whacky Dance-off Extravaganza;Bust your funkiest moves at the Whacky Dance-off Extravaganza, using your charisma and improvisation to out-dance zany opponents.;Charisma;6;24
Mischievous Prankster Adventure;Embark on the Mischievous Prankster Adventure, relying on your reliability to execute hilarious pranks while avoiding getting caught.;Reliability;4;21
Crazy Scientist's Lab Mishaps;Work in the Crazy Scientist's Lab, where your improvisation will be crucial in handling wild experiments and comical lab mishaps.;Improvisation;5;23
Wacky Water Balloon Frenzy;Partake in the Wacky Water Balloon Frenzy, where your reliability and precision will be challenged in fast-paced and splashy water balloon games.;Reliability;3;18
Silly Face Art Contest;Showcase your creativity and improvisation in the Silly Face Art Contest, where you'll paint funny and absurd expressions on willing participants.;Improvisation;4;20
Clumsy Waiter Challenge;Take on the Clumsy Waiter Challenge, showcasing your charisma while serving dishes with hilarious mishaps at a comical restaurant.;Charisma;2;17
Pirate Puns Battle;Engage in the Pirate Puns Battle, using your charisma and wit to deliver the funniest pirate-themed puns in a humorous wordplay showdown.;Charisma;4;21
Joyful Picnic in the Sun;Have a delightful day at the Joyful Picnic in the Sun, where your charisma will bring laughter and happiness to everyone present.;Charisma;2;16
Cheerful Carnival Parade;Join the Cheerful Carnival Parade, showcasing your improvisation skills as you dance and spread happiness among the festive crowd.;Improvisation;3;18
Happy Puppy Adoption Day;Celebrate the Happy Puppy Adoption Day, where your charisma will bring joy to families as they welcome adorable puppies into their homes.;Charisma;4;20
Enchanted Fairy Garden Party;Be enchanted at the Enchanted Fairy Garden Party, using your charisma to create magical moments for guests and fairies alike.;Charisma;5;22
Bubbly Bubblegum Blowing Contest;Participate in the Bubbly Bubblegum Blowing Contest, showcasing your reliability in creating the biggest and happiest bubblegum bubbles.;Reliability;3;19
Giggling Baby Panda Playtime;Join the Giggling Baby Panda Playtime, where your charisma will amuse and entertain adorable baby pandas in a heartwarming setting.;Charisma;2;16
Colorful Holi Festival Celebration;Celebrate the Colorful Holi Festival, using your charisma to spread happiness and positivity through vibrant colors and laughter.;Charisma;4;21
Happy Street Performer Showcase;Take the spotlight at the Happy Street Performer Showcase, entertaining passersby with your improvisation and joyous performances.;Improvisation;3;18
Smiling Balloon Sculpture Workshop;Spread smiles at the Smiling Balloon Sculpture Workshop, using your creativity to craft delightful balloon sculptures for children.;Improvisation;4;20
Butterfly Garden Fluttering Ballet;Perform in the Butterfly Garden Fluttering Ballet, where your charisma will bring a sense of wonder and joy to the audience.;Charisma;5;22
Beaming Sunflower Farm Visit;Enjoy a Beaming Sunflower Farm Visit, where your charisma will brighten the day as you explore stunning sunflower fields.;Charisma;3;19
Happy Dance Flash Mob;Join the Happy Dance Flash Mob, spreading joy and happiness as you dance with a group of enthusiastic and cheerful dancers.;Charisma;4;21
Delightful Dessert Baking Party;Take part in the Delightful Dessert Baking Party, using your creativity to bake and decorate scrumptious treats for a joyful gathering.;Improvisation;2;16
Happy Birthday Surprise Bash;Throw a Happy Birthday Surprise Bash, showcasing your reliability in organizing a heartwarming celebration for a special someone.;Reliability;5;23
Playful Dolphin Encounter;Embark on a Playful Dolphin Encounter, where your charisma will create magical moments while interacting with playful and friendly dolphins.;Charisma;4;20
Smiling Children's Playground Fun;Bring smiles to children at the Smiling Children's Playground Fun, engaging them in joyful games and activities with your charisma.;Charisma;3;18
Sunny Beach Sandcastle Contest;Compete in the Sunny Beach Sandcastle Contest, using your improvisation and creativity to build the happiest and most impressive sandcastle.;Improvisation;4;20
Joyful Community Garden Planting;Contribute to the Joyful Community Garden Planting, where your reliability will help create a beautiful and happy green space for all.;Reliability;3;19
Uplifting Choir Sing-Along;Join the Uplifting Choir Sing-Along, using your charisma to lift spirits as you sing joyous and heartwarming songs with fellow singers.;Charisma;5;22
Happy Family Reunion Picnic;Celebrate a Happy Family Reunion Picnic, where your charisma will foster love and laughter among family members coming together.;Charisma;3;17
Playful Puppies Day Out;Spend a Playful Puppies Day Out, where your charisma will brighten the day as you play and cuddle with adorable and energetic puppies.;Charisma;2;16
Joyful Street Carnival;Join the Joyful Street Carnival, showcasing your improvisation skills as you engage in fun games and activities with cheerful attendees.;Improvisation;3;18
Happy Bunny Adoption Day;Celebrate the Happy Bunny Adoption Day, where your charisma will bring joy to families as they adopt lovable bunnies.;Charisma;4;20
Enchanted Forest Tea Party;Be charmed at the Enchanted Forest Tea Party, using your charisma to create a whimsical and delightful experience for guests and forest creatures.;Charisma;5;22
Bubbly Bubble Bath Fun;Participate in the Bubbly Bubble Bath Fun, showcasing your reliability in creating a relaxing and fun-filled bubble bath experience.;Reliability;3;19
Giggling Baby Koala Encounter;Experience the Giggling Baby Koala Encounter, where your charisma will bring laughter and happiness while interacting with cute baby koalas.;Charisma;2;16
Colorful Kite Flying Festival;Celebrate the Colorful Kite Flying Festival, using your charisma to bring smiles and excitement as you fly vibrant kites in the sky.;Charisma;4;21
Happy Busker's Street Performance;Take the stage as a Happy Busker, entertaining passersby with your improvisation and joyous street performances.;Improvisation;3;18
Smiling Balloon Release Event;Spread smiles at the Smiling Balloon Release Event, using your creativity to organize a heartwarming balloon release for a special occasion.;Improvisation;4;20
Butterfly Garden Yoga Retreat;Find inner joy at the Butterfly Garden Yoga Retreat, where your charisma will create a serene and uplifting yoga experience amidst fluttering butterflies.;Charisma;5;22
Beaming Sunflower Bouquet Delivery;Delight recipients with a Beaming Sunflower Bouquet Delivery, where your charisma will bring happiness through the gift of vibrant sunflowers.;Charisma;3;19
Happy Feet Dance Class;Take part in the Happy Feet Dance Class, using your charisma to encourage joyful dancing and light-hearted fun with fellow participants.;Charisma;4;21
Cupcake Decorating Workshop;Showcase your creativity and improvisation in the Delightful Cupcake Decorating Workshop, where you'll create joyful and delicious treats.;Improvisation;2;16
Happy Retirement Celebration;Throw a Happy Retirement Celebration, showcasing your reliability in organizing a heartwarming event to honor someone's retirement.;Reliability;5;23
Playful Dolphin Water Park;Embark on a Playful Dolphin Water Park adventure, where your charisma will create delightful and interactive experiences with playful dolphins.;Charisma;4;20
Smiling Children's Puppet Show;Bring smiles to children at the Smiling Children's Puppet Show, entertaining them with cheerful and funny puppet performances using your charisma.;Charisma;3;18
Sunny Beach Volleyball Tournament;Compete in the Sunny Beach Volleyball Tournament, using your improvisation and teamwork to spread happiness through friendly competition.;Improvisation;4;20
Joyful Community Art Mural Project;Contribute to the Joyful Community Art Mural Project, where your reliability and creativity will add color and happiness to the neighborhood.;Reliability;3;19
Uplifting Flash Mob Dance;Join the Uplifting Flash Mob Dance, using your charisma and dance moves to surprise and uplift the spirits of unsuspecting onlookers.;Charisma;5;22
Happy Birthday Carnival Celebration;Celebrate a Happy Birthday Carnival Celebration, where your charisma will create a joyous and memorable birthday party for someone special.;Charisma;3;17
Cheerful Bubble Blowing Contest;Participate in the Cheerful Bubble Blowing Contest, showcasing your improvisation and bubbly spirit as you blow mesmerizing bubbles.;Improvisation;4;21
Smiling Petting Zoo Encounter;Experience the Smiling Petting Zoo Encounter, where your charisma will bring delight and joy to visitors as they interact with friendly animals.;Charisma;2;17
Joyful Community Park Cleanup;Contribute to the Joyful Community Park Cleanup, using your reliability to create a cleaner and happier environment for everyone to enjoy.;Reliability;3;18
Happy Family Movie Night;Host a Happy Family Movie Night, showcasing your charisma in organizing a heartwarming movie screening with popcorn and fun for all.;Charisma;4;21
Enthusiastic Dance Party Jam;Join the Enthusiastic Dance Party Jam, using your charisma and dance moves to get everyone grooving to joyful and infectious beats.;Charisma;5;23
Delightful Summer Camp Adventure;Embark on a Delightful Summer Camp Adventure, where your improvisation and cheerfulness will create unforgettable memories with fellow campers.;Improvisation;3;19
Happy Treetop Canopy Tour;Experience a Happy Treetop Canopy Tour, where your charisma will create thrilling and joyous moments as you explore the forest from above.;Charisma;4;22
Colorful Paint Party Extravaganza;Celebrate a Colorful Paint Party Extravaganza, using your charisma to guide participants in a lively and joyous paint-throwing celebration.;Charisma;3;18
Beaming Children's Birthday Party;Organize a Beaming Children's Birthday Party, showcasing your reliability in creating a joyful and entertaining celebration for a young celebrant.;Reliability;4;21
Happy Zoo Animal Feeding Tour;Embark on a Happy Zoo Animal Feeding Tour, where your charisma will create a memorable and interactive experience with zoo animals.;Charisma;2;17
Joyful Roller Skating Fun;Experience Joyful Roller Skating Fun, showcasing your improvisation and cheerful spirit as you glide and twirl on roller skates.;Improvisation;3;19
Smiling Nature Hike Adventure;Embark on a Smiling Nature Hike Adventure, where your charisma will uplift the spirits of fellow hikers as you explore beautiful natural landscapes.;Charisma;4;21
Sunny Lemonade Stand Delight;Run a Sunny Lemonade Stand Delight, using your charisma and creativity to serve refreshing lemonade with a smile and warm hospitality.;Charisma;5;22
Happy Pet Adoption Fair;Participate in the Happy Pet Adoption Fair, where your charisma will help loving families find their perfect furry companions.;Charisma;3;18
Cheerful Karaoke Sing-Off;Join the Cheerful Karaoke Sing-Off, using your charisma and vocal talent to spread happiness through vibrant and entertaining performances.;Charisma;4;20
Smiling Water Balloon Fight;Take part in the Smiling Water Balloon Fight, where your improvisation and cheerfulness will make the water balloon battle a joyful and refreshing experience.;Improvisation;3;17
Colorful Origami Art Workshop;Showcase your creativity and charisma in the Colorful Origami Art Workshop, guiding participants to create delightful and colorful origami masterpieces.;Charisma;4;19
Uplifting Kindness Campaign;Contribute to the Uplifting Kindness Campaign, using your reliability and warmth to spread joy and positivity through random acts of kindness.;Reliability;5;23
Happy Bubble Bath Spa Retreat;Indulge in a Happy Bubble Bath Spa Retreat, where your charisma will create a relaxing and blissful experience of self-care and happiness.;Charisma;2;17
Joyful Outdoor Yoga Class;Join the Joyful Outdoor Yoga Class, using your charisma to lead a peaceful and uplifting yoga session amidst beautiful natural surroundings.;Charisma;3;20
Crazy Chicken Dance-Off;Compete in the Crazy Chicken Dance-Off, where your charisma and improvisation will be put to the test in an uproarious chicken dance competition.;Improvisation;3;18
Hilarious Costume Party;Attend a Hilarious Costume Party, showcasing your creativity and charisma as you dress up in the funniest and most outrageous costumes.;Charisma;4;20
Goofy Grandparent Olympics;Participate in the Goofy Grandparent Olympics, where your reliability will be tested in funny and quirky challenges for spirited grandparents.;Reliability;2;15
Laughing Yoga Class;Join the Laughing Yoga Class, using your charisma to lead a session of contagious laughter and joyous yoga exercises.;Charisma;3;18
Silly Sock Puppet Theater;Put on a Silly Sock Puppet Theater, using your improvisation to entertain the audience with humorous and quirky sock puppet performances.;Improvisation;4;21
Jolly Jester's Comedy Show;Take the stage at the Jolly Jester's Comedy Show, where your charisma will spread laughter with a repertoire of hilarious jokes and antics.;Charisma;5;23
Wacky Potato Sack Race;Race in the Wacky Potato Sack Race, showcasing your reliability and hilarious movements in a goofy and amusing sack race.;Reliability;3;19
Circus Clown Circus;Join the Circus Clown Circus, where your charisma and creativity will shine as you perform side-splitting acts with your fellow circus clowns.;Charisma;4;20
Silly Face Expression Challenge;Participate in the Silly Face Expression Challenge, showcasing your improvisation in creating the silliest and funniest facial expressions.;Improvisation;5;22
